Пассив в придаточных предложениях; Passiv in untergeordneten Klauseln
Sie hat gesagt, dass heute alles entschieden werden soll.;;;Она сказала, что сегодня все должно решиться.;;
Wir denken, dass dieses Buch nicht veröffentlicht wird.;;;Мы думаем, что эта книга не будет издана.;;
Sie sagt, dass jetzt keine Pause gemacht werden darf.;;;Она говорит, что сейчас нельзя делать паузу.;;
Er hat gesagt, dass sie zuerst gefragt werden soll.;;;Он сказал, что сначала надо ее спросить.;;
Der Lehrer sagt, dass dieses Buch unbedingt durchgelesen werden soll.;;;Учитель говорит, что эта книга обязательно должна быть прочитана.;;